{
  "schema_version": "0.1",
  "wound_id": "invisibilidad_relacional",
  "taxonomy_version": "wound-taxonomy-pilot-0.1",
  "name": "Invisibilidad Relacional",
  "aliases": [
    "No ser visto por quien debía protegerme",
    "Sentirme invisible en grupo"
  ],
  "source_status": "consolidated_source",
  "provenance": [
    {
      "source_id": "HERIDA-1-CONSOLIDADA",
      "title": "HERIDA 1: Invisibilidad Relacional",
      "version": null,
      "locator": "Nodo emocional, manifestaciones, geometría, frecuencia, correlato cristalino y mapa dimensional",
      "uri": null,
      "layer": "source_symbolic",
      "notes": "Documento consolidado que integra antiguas Heridas 1 y 10."
    }
  ],
  "node_emotional": "Invisibilidad afectiva + negación social del ser.",
  "manifestations": [
    "Sensación de no importar o no existir emocionalmente.",
    "Dificultad para ocupar espacio físico o expresivo.",
    "Invisibilidad dentro de dinámicas grupales o familiares.",
    "Ausencia de reconocimiento por figuras clave.",
    "Desconexión con el entorno y con la propia presencia."
  ],
  "symbolic_geometry": {
    "primary": [
      "Punto fractal apagado dentro de una red no receptiva.",
      "Tetraedro invertido dentro de un Octaedro."
    ],
    "dimensional": [
      "Bloqueo de la conexión 2º–4º chakra.",
      "Distorsión del anclaje 3D con retroalimentación 5D."
    ],
    "interpretation": "El documento lo presenta como desequilibrio simbólico entre emoción, placer, amor y anclaje."
  },
  "symbolic_frequencies": {
    "base_hz": 174,
    "complementary_hz": [
      111,
      639
    ],
    "status": "source_symbolic",
    "claim_boundary": "Correspondencia interna del corpus; no se codifica como efecto fisiológico validado."
  },
  "mathematical_models": [
    {
      "expression": "E(t+1) = αE(t) - βV(t)",
      "variables": {
        "E": "energía empática interna",
        "V": "visibilidad percibida",
        "α": "constante de resonancia afectiva",
        "β": "inhibidor de validación"
      },
      "status": "source_symbolic"
    }
  ],
  "organic_correlates": [
    {
      "name": "timo",
      "source_description": "Correlato físico indicado por el documento.",
      "status": "source_symbolic",
      "medical_validation": false
    },
    {
      "name": "sistema entérico",
      "source_description": "Correlato físico indicado por el documento.",
      "status": "source_symbolic",
      "medical_validation": false
    },
    {
      "name": "ojos",
      "source_description": "Correlato físico indicado por el documento.",
      "status": "source_symbolic",
      "medical_validation": false
    }
  ],
  "cognitive_correlates": [
    "autoanulación",
    "pensamiento confusional"
  ],
  "emotional_correlates": [
    "retraimiento",
    "tristeza pasiva"
  ],
  "crystal_correlates": [
    {
      "mineral": "Halita",
      "system": "Cúbico isométrico",
      "interpretation": "Límites simbólicos que colapsan cuando no hay validación afectiva.",
      "status": "source_symbolic"
    },
    {
      "mineral": "Fluorita",
      "system": "Cúbico truncado",
      "interpretation": "Estructuras mentales organizadas que se distorsionan ante caos o sobreestimulación externa.",
      "status": "source_symbolic"
    }
  ],
  "dimensional_map": {
    "3D": "Cuerpo invisibilizado",
    "4D": "Campo afectivo silenciado",
    "5D": "Amor superior no encarnado"
  },
  "seed_phrase": "Existo, aunque nunca me hayan visto.",
  "shadows": [
    "autoabandono",
    "retraimiento",
    "camaleonismo emocional"
  ],
  "egregores": [],
  "deities_or_demons": [],
  "related_crystallization_ids": [
    "retencion_afectiva"
  ],
  "observable_candidates": [
    {
      "id": "felt_presence",
      "label": "Presencia sentida",
      "derivation": "Derivada experimentalmente de la manifestación fuente «desconexión con el entorno y con la propia presencia».",
      "status": "experimental_operationalization"
    },
    {
      "id": "space_occupancy",
      "label": "Facilidad percibida para ocupar espacio",
      "derivation": "Derivada experimentalmente de «dificultad para ocupar espacio físico o expresivo».",
      "status": "experimental_operationalization"
    },
    {
      "id": "expression_impulse",
      "label": "Impulso de expresión",
      "derivation": "Variable neutral propuesta para observar el polo expresivo sin nombrar la herida durante la prueba.",
      "status": "experimental_operationalization"
    },
    {
      "id": "withdrawal_impulse",
      "label": "Impulso de retraimiento",
      "derivation": "Derivada de las manifestaciones de retraimiento/desconexión del perfil fuente.",
      "status": "experimental_operationalization"
    }
  ],
  "epistemic_boundary": {
    "diagnostic": false,
    "causal": false,
    "physiological": false,
    "note": "El perfil organiza una hipótesis simbólica de Ars Caeli. Las variables observables propuestas deben validarse por separado."
  }
}